{
  "assets" : {
    "databricks" : {
      "name" : "Databricks",
      "paths" : [
        "M13.7194 6.60746L7.25506 10.338L0.332928 6.35214L0 6.53654L0 9.43016L7.25506 13.6004L13.7194 9.88406V11.416L7.25506 15.1465L0.332928 11.1607L0 11.3451L0 11.8415L7.25506 16.0117L14.4962 11.8415V8.94789L14.1633 8.76349L7.25506 12.7351L0.776832 9.01881L0.776832 7.4869L7.25506 11.2032L14.4962 7.033V4.18193L14.1356 3.96917L7.25506 7.92661L1.10976 4.40888L7.25506 0.876967L12.3045 3.78477L12.7484 3.52945V3.17484L7.25506 0.0117187L0 4.18193L0 4.63583L7.25506 8.80605L13.7194 5.07555V6.60746Z"
      ],
      "source" : "https://www.databricks.com/sites/default/files/2024-10/Databricks-Logo-Icon.svg",
      "viewBox" : [
        0,
        0,
        15,
        17
      ]
    }
  },
  "connectors" : {
    "govern" : {
      "dashed" : true,
      "direction" : "forward",
      "from" : {
        "element" : "catalog",
        "side" : "top"
      },
      "label" : "Governance",
      "routing" : "orthogonal",
      "to" : {
        "element" : "lakehouse",
        "side" : "bottom"
      }
    },
    "ingest" : {
      "dashed" : false,
      "direction" : "forward",
      "from" : {
        "element" : "sources",
        "side" : "right"
      },
      "label" : "Batch / CDC",
      "routing" : "orthogonal",
      "to" : {
        "element" : "ingestion",
        "side" : "left"
      }
    },
    "query" : {
      "dashed" : false,
      "direction" : "forward",
      "from" : {
        "element" : "lakehouse",
        "side" : "right"
      },
      "label" : "SQL / API",
      "routing" : "orthogonal",
      "to" : {
        "element" : "assistant",
        "side" : "left"
      }
    },
    "store" : {
      "dashed" : false,
      "direction" : "forward",
      "from" : {
        "element" : "ingestion",
        "side" : "bottom"
      },
      "label" : "Delta",
      "routing" : "orthogonal",
      "to" : {
        "element" : "lakehouse",
        "side" : "top"
      }
    }
  },
  "containers" : {
    "canvas" : {
      "children" : [
        "platform",
        "assistant",
        "sources"
      ],
      "layout" : {
        "gap" : 28,
        "mode" : "free",
        "padding" : 28
      }
    },
    "platform" : {
      "allowedChildTypes" : [
        "service",
        "database"
      ],
      "children" : [
        "ingestion",
        "lakehouse",
        "catalog"
      ],
      "label" : "Databricks Platform",
      "layout" : {
        "gap" : 28,
        "mode" : "vertical",
        "padding" : 28
      },
      "position" : {
        "x" : 345,
        "y" : 40
      }
    }
  },
  "id" : "t1a-data-platform",
  "nodes" : {
    "assistant" : {
      "label" : "AI Application",
      "position" : {
        "x" : 680,
        "y" : 236.8148193359375
      },
      "shape" : "rectangle",
      "type" : "application"
    },
    "catalog" : {
      "label" : "Unity Catalog",
      "shape" : "rectangle",
      "type" : "service"
    },
    "ingestion" : {
      "label" : "Ingestion",
      "shape" : "rectangle",
      "type" : "service"
    },
    "lakehouse" : {
      "asset" : "databricks",
      "label" : "Lakehouse",
      "shape" : "cylinder",
      "strokeWidth" : 3,
      "type" : "database"
    },
    "sources" : {
      "label" : "Enterprise Systems",
      "position" : {
        "x" : 37.9008203125,
        "y" : 103.66972656249996
      },
      "shape" : "rectangle",
      "type" : "application"
    }
  },
  "root" : "canvas",
  "schemaVersion" : 1,
  "theme" : {
    "fontFamily" : "Helvetica",
    "fontSize" : 16,
    "preset" : "standard",
    "seed" : 42,
    "sketch" : true,
    "strokeWidth" : 1.6,
    "version" : 1
  },
  "title" : "T1A Data Platform",
  "watermark" : true
}
